### ISSUE TITLE
eBPF Issue with Bottlerocket 1.16 and EKS 1.28

### ISSUE THREAD

**Issue by JessePython** [bottlerocket-os/bottlerocket#3632]
**Image I'm using:**
ami-0e71498b4e4e56727

**What I expected to happen:**
Updated from Bottlerocket 1.15 and EKS 1.27 to Bottlerocket 1.16 and EKS 1.28. Container networking relies on Calico CNI with eBPF and WireGuard. Calico is installed from binary (not built from source) and uses latest version, but versions 3.26.1, 3.26.2, 3.26.3 and 3.26.4 have all been tested with no success.

**What actually happened:**

Networking stopped.

Errors Observed on the calico-node:
libbpf: failed to find valid kernel BTF
libbpf: Error loading vmlinux BTF: -3
libbpf: failed to load object '/usr/lib/calico/bpf/from_wep_fib_no_log_co-re.o'

**How to reproduce the problem:**

Reliably occurs with the combination of Calico, EKS 1.28 and Bottlerocket 1.16

**Comment by JessePython** [comment]
When asked whether they had tested Bottlerocket 1.16 with EKS 1.27:

> No as its not appear to be available while you are on EKS v 1.27 and using managed nodegroups.
> The node group AMI release version usually updated  in according to the latest available version for your 1.27 cluster, and it's 1.15. for eks cluster v 1.28 - it's 1.16
> 
> Maybe we can enforce of using another AMI version with manual modifications of nodegroup template but we didnt. as we prefer to have managed services - thats why we are using managed EKS from AWS with managed nodegroups.

**Comment by etungsten** [comment]
Hi, 

`libbpf: failed to find valid kernel BTF` indicates that the BTF debug info is not enabled but Bottlerocket's kernel config explicitly enables it here:
https://github.com/bottlerocket-os/bottlerocket/blob/763f6d4c722faead9482c018b60ba90a94dd9e36/packages/kernel-6.1/config-bottlerocket#L100-L101

I'm currently trying to replicate the issue using BR 1.16.1 with an 1.28 cluster and I'm unable to get the described error.

Here's what I tried:

1. Installed calico via helm chart as prescribe in https://docs.tigera.io/calico/latest/getting-started/kubernetes/helm#download-the-helm-chart 
2. Enable eBPF mode as described in https://docs.tigera.io/calico/latest/operations/ebpf/enabling-ebpf#enable-ebpf-mode

And on the Bottlerocket 1.16.1 aws-k8s-1.28 nodes, the calico-node pod runs successfully, example logs from a pod:
```bash
2023-12-01 22:54:12.077 [INFO][50] tunnel-ip-allocator/env_var_loader.go 40: Found felix environment variable: "typhacafile"="/etc/pki/tls/certs/tigera-ca-bundle.crt"
2023-12-01 22:54:12.077 [INFO][50] tunnel-ip-allocator/env_var_loader.go 40: Found felix environment variable: "bpfexttoserviceconnmark"="0x80"
2023-12-01 22:54:12.078 [INFO][50] tunnel-ip-allocator/env_var_loader.go 40: Found felix environment variable: "healthenabled"="true"
2023-12-01 22:54:12.078 [INFO][50] tunnel-ip-allocator/env_var_loader.go 40: Found felix environment variable: "iptablesmangleallowaction"="Return"
2023-12-01 22:54:12.078 [INFO][50] tunnel-ip-allocator/env_var_loader.go 40: Found felix environment variable: "typhacertfile"="/node-certs/tls.crt"
2023-12-01 22:54:12.078 [INFO][50] tunnel-ip-allocator/env_var_loader.go 40: Found felix environment variable: "typhacn"="typha-server"
2023-12-01 22:54:12.078 [INFO][50] tunnel-ip-allocator/env_var_loader.go 40: Found felix environment variable: "routesource"="WorkloadIPs"
2023-12-01 22:54:12.078 [INFO][50] tunnel-ip-allocator/env_var_loader.go 40: Found felix environment variable: "wireguardhostencryptionenabled"="true"
2023-12-01 22:54:12.078 [INFO][50] tunnel-ip-allocator/env_var_loader.go 40: Found felix environment variable: "typhakeyfile"="/node-certs/tls.key"
2023-12-01 22:54:12.078 [INFO][50] tunnel-ip-allocator/env_var_loader.go 40: Found felix environment variable: "interfaceprefix"="eni"
2023-12-01 22:54:12.078 [INFO][50] tunnel-ip-allocator/env_var_loader.go 40: Found felix environment variable: "defaultendpointtohostaction"="ACCEPT"
2023-12-01 22:54:12.078 [INFO][50] tunnel-ip-allocator/env_var_loader.go 40: Found felix environment variable: "bpfenabled"="true"
2023-12-01 22:54:12.078 [INFO][50] tunnel-ip-allocator/env_var_loader.go 40: Found felix environment variable: "typhak8snamespace"="calico-system"
2023-12-01 22:54:12.078 [INFO][50] tunnel-ip-allocator/env_var_loader.go 40: Found felix environment variable: "healthport"="9099"
2023-12-01 22:54:12.078 [INFO][50] tunnel-ip-allocator/env_var_loader.go 40: Found felix environment variable: "ipv6support"="false"

...
2023-12-01 22:54:19.146 [INFO][45] felix/health.go 336: Overall health status changed: live=true ready=true
+---------------------------+---------+----------------+-----------------+--------+
|         COMPONENT         | TIMEOUT |    LIVENESS    |    READINESS    | DETAIL |
+---------------------------+---------+----------------+-----------------+--------+
| CalculationGraph          | 30s     | reporting live | reporting ready |        |
| FelixStartup              | -       | reporting live | reporting ready |        |
| InternalDataplaneMainLoop | 1m30s   | reporting live | reporting ready |        |
+---------------------------+---------+----------------+-----------------+--------+
```

Can you please elaborate on how calico is being used with Bottlerocket? How is calico being deployed to the cluster?

**Comment by JessePython** [comment]
Responded with a detailed description of their install process:

As I can see you've installed calico but still using AWS VPC CNI. thats does not make sense and eBPF or any other calico features will not work in this mode.

Pls install using this guide: 
Install EKS with Calico networking  https://docs.tigera.io/calico/latest/getting-started/kubernetes/managed-public-cloud/eks#install-eks-with-calico-networking
Also you need to use VXLAN. remove aws-node, disable kube-proxy. 

Here is short HowTO:

eksctl create cluster --name my-calico-cluster --without-nodegroup  # or you may create the cluster with nodegroup with one node and recreate this nodegroup after as we doing this way in terraform 

kubectl delete daemonset -n kube-system aws-node

Next install calico latest version using helm with the next values:

installation: 
  kubernetesProvider: EKS 
  cni: 
    type: Calico 
  calicoNetwork: 
    bgp: Disabled 
    ipPools: 
    - cidr: 10.255.0.0/16
      encapsulation: VXLAN
  nodeSelector:
    kubernetes.io/os: linux

Add or  recreate nodegroups:

eksctl create nodegroup --cluster my-calico-cluster --node-type t3.medium --max-pods-per-node 100


Create the kubernetes-services-endpoint ConfigMap in tigera-operator namespace:
KSVC_HOST=(`kubectl get configmap -n kube-system kube-proxy -o jsonpath='{.data.kubeconfig}' | grep server | awk '{print $2}' | sed 's/https\?:\/\///'`)

kubectl apply -f - <<EOF
kind: ConfigMap
apiVersion: v1
metadata:
  name: kubernetes-services-endpoint
  namespace: tigera-operator
data:
  KUBERNETES_SERVICE_HOST: "$KSVC_HOST"
  KUBERNETES_SERVICE_PORT: "443"
EOF

Next activate EBPF and disable kube-proxy:

kubectl patch ds -n kube-system kube-proxy -p '{\"spec\":{\"template\":{\"spec\":{\"nodeSelector\":{\"non-calico\": \"true\"}}}}}'
#kubectl delete ds kube-proxy -n kube-system
kubectl patch installation.operator.tigera.io default --type merge -p '{"spec":{"calicoNetwork":{"linuxDataplane":"BPF", "hostPorts":null}}}'


Restart all nodes or restart DSes sometimes can also work:
kubectl rollout restart deploy coredns -n kube-system
kubectl rollout restart deployments -n tigera-operator
kubectl rollout restart ds calico-node -n calico-system


SO 
At the end here is our calico felixconfiguration:

$ kubectl get felixconfiguration default -o yaml
apiVersion: projectcalico.org/v3
kind: FelixConfiguration
metadata:
  creationTimestamp: "2023-11-27T09:23:08Z"
  generation: 1
  name: default
  resourceVersion: "593008"
  uid: 53c9df8b-cf5a-4eb5-938e-712be6534d22
spec:
  bpfLogLevel: ""
  floatingIPs: Disabled
  healthPort: 9099
  logSeverityScreen: Info
  reportingInterval: 0s
  wireguardEnabled: true

and calico installiation conf:
$ kubectl get installation default -o yaml
apiVersion: operator.tigera.io/v1
kind: Installation
metadata:
  annotations:
    meta.helm.sh/release-name: calico
    meta.helm.sh/release-namespace: tigera-operator
  finalizers:
  - tigera.io/operator-cleanup
  generation: 4
  labels:
    app.kubernetes.io/managed-by: Helm
  name: default
spec:
  calicoNetwork:
    bgp: Disabled
    hostPorts: Disabled
    ipPools:
    - blockSize: 26
      cidr: 10.246.0.0/16
      disableBGPExport: false
      encapsulation: VXLAN
      natOutgoing: Enabled
      nodeSelector: all()
    linuxDataplane: BPF
    multiInterfaceMode: None
    nodeAddressAutodetectionV4:
      canReach: 8.8.8.8
  cni:
    ipam:
      type: Calico
    type: Calico
  controlPlaneNodeSelector:
    nodegroup_name: emagin-system-nodegroup
  controlPlaneReplicas: 2
  flexVolumePath: /usr/libexec/kubernetes/kubelet-plugins/volume/exec/
  imagePullSecrets: []
  kubeletVolumePluginPath: /var/lib/kubelet
  kubernetesProvider: EKS
  logging:
    cni:
      logFileMaxAgeDays: 30
      logFileMaxCount: 10
      logFileMaxSize: 100Mi
      logSeverity: Info
  nodeUpdateStrategy:
    rollingUpdate:
      maxUnavailable: 1
    type: RollingUpdate
  nonPrivileged: Disabled
  typhaDeployment: {}
  variant: Calico
status:
<<<--ommited-->>>

_____

verify::

Check BPF status from calico-node logs . Logs must contain string like “EBPF 
enabled” and should not contain any errors related to ebpf: 
kubectl logs ds/calico-node -n calico-system | grep "BPF enabled"

Jump inside calico-node pod to check additional eBPF deeply. 
kubectl exec -it ds/calico-node -n calico-system -c calico-node – bash
>calico-node -bpf arp dump
>calico-node -bpf routes dump


____

As result  - you have a cluster withour aws-node and without kube-proxy. All NW handled by calico CNI with enabled EBPF.
This all works perfectly on EKS ver 1.23 , 1.24, 1.25, 1.26, 1.27. BUT NOT on 1.28

**Comment by vpsgetcom** [comment]
Hi @etungsten,
This is exactly our issue.  we having config  @JessePython  described. https://github.com/bottlerocket-os/bottlerocket/issues/3632#issuecomment-1847400323

> `libbpf: failed to find valid kernel BTF` indicates that the BTF debug info is not enabled but Bottlerocket's kernel config explicitly enables it here..

The  CONFIG_DEBUG_INFO_BTF set to "y" for both Bottlerocket OS 1.15.1  and  Bottlerocket OS 1.16.1.

Bottlerocket OS 1.15.1 (aws-k8s-1.27) : 
```
bash-5.1# cat /etc/os-release
NAME=Bottlerocket
ID=bottlerocket
VERSION="1.15.1 (aws-k8s-1.27)"
PRETTY_NAME="Bottlerocket OS 1.15.1 (aws-k8s-1.27)"
VARIANT_ID=aws-k8s-1.27
VERSION_ID=1.15.1
BUILD_ID=264e294c
HOME_URL="https://github.com/bottlerocket-os/bottlerocket"
SUPPORT_URL="https://github.com/bottlerocket-os/bottlerocket/discussions"
BUG_REPORT_URL="https://github.com/bottlerocket-os/bottlerocket/issues"
DOCUMENTATION_URL="https://bottlerocket.dev"

bash-5.1# uname -rv
5.15.128 #1 SMP Thu Oct 5 19:04:09 UTC 2023

bash-5.1# cat /boot/config | grep  CONFIG_DEBUG_INFO_BTF
CONFIG_DEBUG_INFO_BTF=y
CONFIG_DEBUG_INFO_BTF_MODULES=y
```


Bottlerocket OS 1.16.1 (aws-k8s-1.28):
```
bash-5.1# cat /etc/os-release
NAME=Bottlerocket
ID=bottlerocket
VERSION="1.16.1 (aws-k8s-1.28)"
PRETTY_NAME="Bottlerocket OS 1.16.1 (aws-k8s-1.28)"
VARIANT_ID=aws-k8s-1.28
VERSION_ID=1.16.1
BUILD_ID=763f6d4c
HOME_URL="https://github.com/bottlerocket-os/bottlerocket"
SUPPORT_URL="https://github.com/bottlerocket-os/bottlerocket/discussions"
BUG_REPORT_URL="https://github.com/bottlerocket-os/bottlerocket/issues"
DOCUMENTATION_URL="https://bottlerocket.dev"

bash-5.1# uname -rv
6.1.59 #1 SMP PREEMPT_DYNAMIC Thu Nov  9 07:59:06 UTC 2023

bash-5.1# cat /boot/config | grep CONFIG_DEBUG_INFO_BTF
CONFIG_DEBUG_INFO_BTF=y
CONFIG_DEBUG_INFO_BTF_MODULES=y
```

So it does not seems to be related to the  debug config as it's enabled in both AMIs. 
Anyway  the NW not working in Bottlerocket 1.16.1 (aws-k8s-1.28), but everything work perfect in 1.15.1 (aws-k8s-1.27)

**Comment by foersleo** [comment]
I have tried to reproduce this following the description posted in https://github.com/bottlerocket-os/bottlerocket/issues/3632#issuecomment-1847400323 , although I have to say I did make some adjustments (like not using helm, but going the manual way through kubectl). I seem to fail to reproduce the issue, but I might not get the full calico setup and how it is supposed to look.

Here is what I did:

1. Create an empty cluster:
```
> eksctl create cluster --name my-calico-cluster --without-nodegroup --version 1.28
[...]
2023-12-12 11:08:17 [✔]  EKS cluster "my-calico-cluster" in "eu-central-1" region is ready
```
2. Delete aws-node daemon set:
```
> kubectl delete daemonset -n kube-system aws-node
daemonset.apps "aws-node" deleted
```
3. Install tigera-operator:
```
> kubectl create -f https://raw.githubusercontent.com/projectcalico/calico/v3.26.4/manifests/tigera-operator.yaml
namespace/tigera-operator created
customresourcedefinition.apiextensions.k8s.io/bgpconfigurations.crd.projectcalico.org created
customresourcedefinition.apiextensions.k8s.io/bgpfilters.crd.projectcalico.org created
customresourcedefinition.apiextensions.k8s.io/bgppeers.crd.projectcalico.org created
customresourcedefinition.apiextensions.k8s.io/blockaffinities.crd.projectcalico.org created
customresourcedefinition.apiextensions.k8s.io/caliconodestatuses.crd.projectcalico.org created
customresourcedefinition.apiextensions.k8s.io/clusterinformations.crd.projectcalico.org created
customresourcedefinition.apiextensions.k8s.io/felixconfigurations.crd.projectcalico.org created
customresourcedefinition.apiextensions.k8s.io/globalnetworkpolicies.crd.projectcalico.org created
customresourcedefinition.apiextensions.k8s.io/globalnetworksets.crd.projectcalico.org created
customresourcedefinition.apiextensions.k8s.io/hostendpoints.crd.projectcalico.org created
customresourcedefinition.apiextensions.k8s.io/ipamblocks.crd.projectcalico.org created
customresourcedefinition.apiextensions.k8s.io/ipamconfigs.crd.projectcalico.org created
customresourcedefinition.apiextensions.k8s.io/ipamhandles.crd.projectcalico.org created
customresourcedefinition.apiextensions.k8s.io/ippools.crd.projectcalico.org created
customresourcedefinition.apiextensions.k8s.io/ipreservations.crd.projectcalico.org created
customresourcedefinition.apiextensions.k8s.io/kubecontrollersconfigurations.crd.projectcalico.org created
customresourcedefinition.apiextensions.k8s.io/networkpolicies.crd.projectcalico.org created
customresourcedefinition.apiextensions.k8s.io/networksets.crd.projectcalico.org created
customresourcedefinition.apiextensions.k8s.io/apiservers.operator.tigera.io created
customresourcedefinition.apiextensions.k8s.io/imagesets.operator.tigera.io created
customresourcedefinition.apiextensions.k8s.io/installations.operator.tigera.io created
customresourcedefinition.apiextensions.k8s.io/tigerastatuses.operator.tigera.io created
serviceaccount/tigera-operator created
clusterrole.rbac.authorization.k8s.io/tigera-operator created
clusterrolebinding.rbac.authorization.k8s.io/tigera-operator created
deployment.apps/tigera-operator created
```
4. Configure Calico:
```
> kubectl create -f - <<EOF
> kind: Installation
> apiVersion: operator.tigera.io/v1
> metadata:
>   name: default
> spec:
>   kubernetesProvider: EKS
>   cni:
>     type: Calico
>   calicoNetwork:
>     bgp: Disabled
> EOF
installation.operator.tigera.io/default created
```
5. Add nodes to cluster (were with some additional configuration to select the `aws-k8s-1.28-1.16.1` ami). The big difference to the ami listed in the original issue description is that I did not use the `-nvidia` variant but sister ami without nvidia support:
```
> cat calico-test.yaml 
---
apiVersion: eksctl.io/v1alpha5
kind: ClusterConfig

metadata:
  name: my-calico-cluster
  region: eu-central-1
  version: '1.28'

nodeGroups:
  - name: ng-calico
    instanceType: t3.medium
    desiredCapacity: 1
    maxPodsPerNode: 100
    amiFamily: Bottlerocket
    ami: ami-095132eeb54fa060c
    iam:
       attachPolicyARNs:
          - arn:aws:iam::aws:policy/AmazonEKSWorkerNodePolicy
          - arn:aws:iam::aws:policy/AmazonEKS_CNI_Policy
          - arn:aws:iam::aws:policy/AmazonEC2ContainerRegistryReadOnly
          - arn:aws:iam::aws:policy/AmazonSSMManagedInstanceCore
    ssh:
        allow: true
        publicKeyName: ec2_rsa
    bottlerocket:
      settings:
        motd: "Hello from eksctl!"
> eksctl create nodegroup -f calico-test.yaml 
[...]
2023-12-12 11:16:13 [✔]  created 1 nodegroup(s) in cluster "my-calico-cluster"
2023-12-12 11:16:13 [✔]  created 0 managed nodegroup(s) in cluster "my-calico-cluster"
2023-12-12 11:16:13 [ℹ]  checking security group configuration for all nodegroups
2023-12-12 11:16:13 [ℹ]  all nodegroups have up-to-date cloudformation templates
```
6. Create the kubernetes-services-endpoint config map:
```
> kubectl get configmap -n kube-system kube-proxy -o jsonpath='{.data.kubeconfig}' | grep server | awk '{print $2}' | sed 's/https\?:\/\///')
52db3d1ffbfa08147b0516da089b20e8.gr7.eu-central-1.eks.amazonaws.com
> cat endpoint.yaml 
kind: ConfigMap
apiVersion: v1
metadata:
    name: kubernetes-services-endpoint
    namespace: tigera-operator
data:
    KUBERNETES_SERVICE_HOST: "52db3d1ffbfa08147b0516da089b20e8.gr7.eu-central-1.eks.amazonaws.com"
    KUBERNETES_SERVICE_PORT: "443"
> kubectl apply -f endpoint.yaml 
configmap/kubernetes-services-endpoint created
```
7. Disable kube-proxy and enable ebpf:
```
kubectl patch ds -n kube-system kube-proxy -p '{"spec":{"template":{"spec":{"nodeSelector":{"non-calico": "true"}}}}}'
daemonset.apps/kube-proxy patched
> kubectl delete ds kube-proxy -n kube-system
daemonset.apps "kube-proxy" deleted
> kubectl patch installation.operator.tigera.io default --type merge -p '{"spec":{"calicoNetwork":{"linuxDataplane":"BPF", "hostPorts":null}}}'
installation.operator.tigera.io/default patched
```
8. Restart all the things:
```
>  kubectl rollout restart deploy coredns -n kube-system
deployment.apps/coredns restarted
>  kubectl rollout restart deployments -n tigera-operator
deployment.apps/tigera-operator restarted
>  kubectl rollout restart ds calico-node -n calico-system
daemonset.apps/calico-node restarted
```

This results in the following felix and calico configs:

<details>
  <summary>Felix configuration</summary>

  ```
> kubectl get felixconfiguration default -o yaml
apiVersion: crd.projectcalico.org/v1
kind: FelixConfiguration
metadata:
  annotations:
    projectcalico.org/metadata: '{"uid":"0a0f8f6a-7e85-4406-951a-ba02121ed724","generation":1,"creationTimestamp":"2023-12-12T10:15:50Z","managedFields":[{"manager":"operator","operation":"Update","apiVersion":"crd.projectcalico.org/v1","time":"2023-12-12T10:15:50Z","fieldsType":"FieldsV1","fieldsV1":{"f:spec":{".":{},"f:bpfLogLevel":{},"f:healthPort":{}}}}]}'
  creationTimestamp: "2023-12-12T10:15:50Z"
  generation: 2
  name: default
  resourceVersion: "2552"
  uid: 0a0f8f6a-7e85-4406-951a-ba02121ed724
spec:
  bpfLogLevel: ""
  floatingIPs: Disabled
  healthPort: 9099
  logSeverityScreen: Info
  reportingInterval: 0s
  ```
</details>
<details>
  <summary> calico installation </summary>

  ```
> kubectl get installation default -o yaml
apiVersion: operator.tigera.io/v1
kind: Installation
metadata:
  creationTimestamp: "2023-12-12T10:09:34Z"
  finalizers:
  - tigera.io/operator-cleanup
  generation: 4
  name: default
  resourceVersion: "4097"
  uid: 43e3f357-93b4-48e1-8797-07e7969135f2
spec:
  calicoNetwork:
    bgp: Disabled
    hostPorts: Disabled
    ipPools:
    - blockSize: 26
      cidr: 172.16.0.0/16
      disableBGPExport: false
      encapsulation: VXLAN
      natOutgoing: Enabled
      nodeSelector: all()
    linuxDataplane: BPF
    multiInterfaceMode: None
    nodeAddressAutodetectionV4:
      canReach: 8.8.8.8
  cni:
    ipam:
      type: Calico
    type: Calico
  controlPlaneReplicas: 2
  flexVolumePath: /usr/libexec/kubernetes/kubelet-plugins/volume/exec/
  kubeletVolumePluginPath: /var/lib/kubelet
  kubernetesProvider: EKS
  logging:
    cni:
      logFileMaxAgeDays: 30
      logFileMaxCount: 10
      logFileMaxSize: 100Mi
      logSeverity: Info
  nodeUpdateStrategy:
    rollingUpdate:
      maxUnavailable: 1
    type: RollingUpdate
  nonPrivileged: Disabled
  variant: Calico
status:
  calicoVersion: v3.26.4
  computed:
    calicoNetwork:
      bgp: Disabled
      hostPorts: Disabled
      ipPools:
      - blockSize: 26
        cidr: 172.16.0.0/16
        disableBGPExport: false
        encapsulation: VXLAN
        natOutgoing: Enabled
        nodeSelector: all()
      linuxDataplane: BPF
      multiInterfaceMode: None
      nodeAddressAutodetectionV4:
        canReach: 8.8.8.8
    cni:
      ipam:
        type: Calico
      type: Calico
    controlPlaneReplicas: 2
    flexVolumePath: /usr/libexec/kubernetes/kubelet-plugins/volume/exec/
    kubeletVolumePluginPath: /var/lib/kubelet
    kubernetesProvider: EKS
    logging:
      cni:
        logFileMaxAgeDays: 30
        logFileMaxCount: 10
        logFileMaxSize: 100Mi
        logSeverity: Info
    nodeUpdateStrategy:
      rollingUpdate:
        maxUnavailable: 1
      type: RollingUpdate
    nonPrivileged: Disabled
    variant: Calico
  conditions:
  - lastTransitionTime: "2023-12-12T10:22:27Z"
    message: All Objects Available
    observedGeneration: 4
    reason: AllObjectsAvailable
    status: "False"
    type: Progressing
  - lastTransitionTime: "2023-12-12T10:22:27Z"
    message: All Objects Available
    observedGeneration: 4
    reason: AllObjectsAvailable
    status: "False"
    type: Degraded
  - lastTransitionTime: "2023-12-12T10:22:27Z"
    message: All objects available
    observedGeneration: 4
    reason: AllObjectsAvailable
    status: "True"
    type: Ready
  mtu: 8951
  variant: Calico
  ```
</details>

If I see correctly when checking the BPF enpoint seems to be happy:

```
>  kubectl logs ds/calico-node -n calico-system | grep "BPF enabled"
Defaulted container "calico-node" out of: calico-node, flexvol-driver (init), mount-bpffs (init), install-cni (init)
2023-12-12 10:21:50.456 [INFO][52] felix/int_dataplane.go 409: BPF enabled, configuring iptables layer to clean up kube-proxy's rules.
2023-12-12 10:21:50.473 [INFO][52] felix/int_dataplane.go 638: BPF enabled, starting BPF endpoint manager and map manager.
2023-12-12 10:21:50.556 [INFO][52] felix/int_dataplane.go 1959: BPF enabled, disabling unprivileged BPF usage.


> kubectl exec -it ds/calico-node -n calico-system -c calico-node bash
kubectl exec [POD] [COMMAND] is DEPRECATED and will be removed in a future version. Use kubectl exec [POD] -- [COMMAND] instead.
[root@ip-192-168-48-154 /]# calico-node -bpf arp dump
W1212 14:34:22.541820   30326 feature_gate.go:241] Setting GA feature gate ServiceInternalTrafficPolicy=true. It will be removed in a future release.
[root@ip-192-168-48-154 /]# calico-node -bpf routes dump
W1212 14:34:31.453257   30348 feature_gate.go:241] Setting GA feature gate ServiceInternalTrafficPolicy=true. It will be removed in a future release.
 3.68.183.40/32: local host
  172.16.0.0/16: remote in-pool nat-out
172.16.8.128/32: local host
172.16.8.132/32: local workload in-pool nat-out idx 9
172.16.8.133/32: local workload in-pool nat-out idx 10
172.16.8.134/32: local workload in-pool nat-out idx 13
172.16.8.135/32: local workload in-pool nat-out idx 14
192.168.48.154/32: local host
```

As far as I can tell my cluster is condfigured like you would like to see it:

```
> kubectl get pods --all-namespaces
NAMESPACE         NAME                                      READY   STATUS    RESTARTS   AGE
calico-system     calico-kube-controllers-9f8595449-tjkvt   1/1     Running   0          4h15m
calico-system     calico-node-8gfrd                         1/1     Running   0          4h14m
calico-system     calico-typha-58cd4c4b58-qqfw6             1/1     Running   0          4h15m
calico-system     csi-node-driver-sbqs4                     2/2     Running   0          4h20m
kube-system       coredns-5f6f6585b5-pgh4l                  1/1     Running   0          4h14m
kube-system       coredns-5f6f6585b5-q4whn                  1/1     Running   0          4h14m
tigera-operator   tigera-operator-5cd87d8b9d-kj8rx          1/1     Running   0          4h14m
```

Please let me know if I overlooked something, or if my cluster is not configured in a way to mimic what you are doing (I am not an expert on calico setups). I will try this again with the nvidia variant, but I would not expect a different outcome. Can you share what instance type you are running on, so I can build my test cluster with as much similiarity to your problematic system as possible?

**Comment by foersleo** [comment]
I also had a look at the code in libbpf that emits that error you are seeing. The code will go through a list of known locations to load the vmlinux BTF information. It emits this error if it can not successfully parse the BTF information for any of these locations. For Bottlerocket the code should find the correct file at the first option under `/sys/kernel/btf/vmlinux`.

The code has been changed slightly between 5.15 and 6.1 kernel series, in that the list of locations does not contain an additional flag for if that location is expected to hold the information in raw or elf format. The new code will go through the list an first try to parse the information in raw mode, and fall back to parsing in elf mode ([Kernel commit for reference](https://git.kernel.org/pub/scm/linux/kernel/git/stable/linux.git/commit/?h=01f2e36c959c813a532ae836db49b2ac9de46de4)). This should not have a functional impact on BTF loading for `/sys/kernel/btf/vmlinux`.

**Comment by JessePython** [comment]
> Can you share what instance type you are running on, so I can build my test cluster with as much similiarity to your problematic system as possible?

It's a mix of t3a.large and t3a.medium

**Comment by foersleo** [comment]
Thanks for that piece of information @JessePython, as far as I can tell the ami you are specifying in the original issue description is the ami for the nvidia variant: ` ami-0e71498b4e4e56727 - bottlerocket-aws-k8s-1.28-nvidia-x86_64-v1.16.1-763f6d4c`.
As far as I am aware that should not really work overall on t3a.*. If I recall correctly AMIs with nvidia drivers are not supposed to start up correctly on machines without nvidia cards.

Is that ami-id correct? I will have a go through trying to get the testing redone with the nvidia ami on the t3a.* hosts. But that ami seems to be not the right one for that platform.

**Comment by foersleo** [comment]
So I have tried the nvidia ami on t3a.medium host and as expected the instance will refuse to come up properly:

```
[   11.270609] NVRM: No NVIDIA GPU found.
[   11.548080] NVRM: No NVIDIA GPU found.
[   11.796780] NVRM: No NVIDIA GPU found.
[   11.894517] driverdog[1069]: 09:04:56 [ERROR] '/usr/bin/modprobe' failed - stderr: modprobe: ERROR: could not insert 'nvidia': No such device
[   11.897692] driverdog[1069]: modprobe: ERROR: could not insert 'nvidia_modeset': No such device
[   11.899924] driverdog[1069]: modprobe: ERROR: could not insert 'nvidia_uvm': No such device
[FAILED] Failed to start Load additional kernel modules.
See 'systemctl status load-kernel-modules.service' for details.
[DEPEND] Dependency failed for Bottlerocket initial configuration complete.
[DEPEND] Dependency failed for Isolates configured.target.
```

So there is no real way to go through the motions of getting all of the rest of the setup done as the bare minimum is not achievable. I think we are missing some important piece here with regards to the original failing setup. Can you please double check which AMI was used, so we can ensure we do look at the right things when trying to reproduce and root cause the issue?

**Comment by vpsgetcom** [comment]
As from the reply  https://github.com/bottlerocket-os/bottlerocket/issues/3632#issuecomment-1852165431 I can see that  currently there only one node in cluster. can you add one more node and also test network using some utils/ubuntu pod?

Like:

`kubectl run --rm utils -it --image arunvelsriram/utils bash `

 And test the NW from this pod with nslookup, ping, curl on internal and external resources.

I'm not sure why nvidia appeared here for AMI. we do not use GPU powered nodes for EKS. 
Currently the next AMI is used for EKS 1.28:

AMI ID: ami-095132eeb54fa060c
AMI name:  bottlerocket-aws-k8s-1.28-x86_64-v1.16.1-763f6d4c
Owner account ID:   14972*****08

We can add or drain nodes properly within this cluster. Nodes boot w/o any issues.  NW issue appear only for pod networking.

**Comment by foersleo** [comment]
I have setup another cluster (with t3a.medium instead of t3.medium) with three nodes this time:

```
> kubectl get nodes
NAME                                              STATUS   ROLES    AGE   VERSION
ip-192-168-22-138.eu-central-1.compute.internal   Ready    <none>   23m   v1.28.3-eks-e7a04cd
ip-192-168-35-62.eu-central-1.compute.internal    Ready    <none>   23m   v1.28.3-eks-e7a04cd
ip-192-168-83-225.eu-central-1.compute.internal   Ready    <none>   23m   v1.28.3-eks-e7a04cd
```

```
]> kubectl get pods --all-namespaces
NAMESPACE         NAME                                       READY   STATUS    RESTARTS      AGE
calico-system     calico-kube-controllers-85c45bff74-lrbxl   1/1     Running   0             20m
calico-system     calico-node-6896b                          1/1     Running   0             19m
calico-system     calico-node-6pmsf                          1/1     Running   0             19m
calico-system     calico-node-v7plk                          1/1     Running   0             19m
calico-system     calico-typha-5b444d87f7-gnrjp              1/1     Running   0             20m
calico-system     calico-typha-5b444d87f7-pgfhm              1/1     Running   0             20m
calico-system     csi-node-driver-4wgq8                      2/2     Running   0             21m
calico-system     csi-node-driver-bmjhl                      2/2     Running   0             21m
calico-system     csi-node-driver-qwtj4                      2/2     Running   0             21m
default           utils                                      1/1     Running   0             18m
kube-system       coredns-67449f89cd-4q2wx                   1/1     Running   0             20m
kube-system       coredns-67449f89cd-pwrjl                   1/1     Running   0             20m
tigera-operator   tigera-operator-858574bd65-7pzkz           1/1     Running   1 (19m ago)   19m
```

Cluster seems happy, and networking from the `utils` pod seems to work as well (curl/nslookup/ping for google and github works as expected).

Is there anything else that is special about your cluster? From the looks of it it seems that the Bottlerocket image is not broken for all setups.

**Comment by vpsgetcom** [comment]
We also using Wireguard enabled  (but in our cluster NW not working anyway Wireguard enabled or disabled) 
Could you pls enable wireguard for your config and ensure that its working:

Enable WireGuard:
`kubectl patch felixconfiguration default --type='merge' -p '{"spec":{"wireguardEnabled":true}}' `

Restart Application Pods (if necessary): Restart your application pods to ensure they use WireGuard encryption.

Fast Check WireGuard 
FelixConfiguration:
`kubectl get felixconfiguration default -o yaml | grep wireguard`

Verify WireGuard Keys on Nodes:
`kubectl get nodes -o yaml | grep WireguardPublicKey `
You should see the keys for all nodes.

Check from bottlerocket admin-container on the node  with tcpdump on wireguard.cali interface. Ensure saome traffic is ongoing (for example  pings from utils pod)
`tcpdump -i wireguard.cali`


If wireguard is not working try to disable it, disable ebpf, enable wireguard and then enable ebpf.

**Comment by foersleo** [comment]
So enabling and using wireguard also seems to work as expected:

```
>  kubectl get nodes -o yaml | grep WireguardPublicKey 
      projectcalico.org/WireguardPublicKey: db5withHt7693**********0Egdu0npLhw3j6sN3zHs=
      projectcalico.org/WireguardPublicKey: YJLbFYccv8Pq**********BKNgTQrwtkkmscacWQl10=
      projectcalico.org/WireguardPublicKey: Olv+FKRy+fxD**********iwkNuLXS7csAmMLFtZrlk=
```

TCP dump on the node:

```
sudo tcpdump -i wireguard.cali
tcpdump: verbose output suppressed, use -v or -vv for full protocol decode
listening on wireguard.cali, link-type RAW (Raw IP), capture size 262144 bytes
14:19:57.055394 IP ip-172-16-107-8.eu-central-1.compute.internal.36327 > ip-172-16-72-68.eu-central-1.compute.internal.domain: 56955+ A? www.google.com.cluster.local. (46)
14:19:57.056654 IP ip-172-16-107-8.eu-central-1.compute.internal.36327 > ip-172-16-72-68.eu-central-1.compute.internal.domain: 63617+ AAAA? www.google.com.cluster.local. (46)
14:19:57.059274 IP ip-172-16-72-68.eu-central-1.compute.internal.domain > ip-172-16-107-8.eu-central-1.compute.internal.36327: 63617 NXDomain*- 0/1/0 (139)
14:19:57.059312 IP ip-172-16-72-68.eu-central-1.compute.internal.domain > ip-172-16-107-8.eu-central-1.compute.internal.36327: 56955 NXDomain*- 0/1/0 (139)
```

While pinging google.com from the utils pod:

```
utils@utils:~$ ping www.google.com
PING www.google.com (142.250.184.196) 56(84) bytes of data.
64 bytes from fra24s11-in-f4.1e100.net (142.250.184.196): icmp_seq=1 ttl=57 time=1.20 ms
64 bytes from fra24s11-in-f4.1e100.net (142.250.184.196): icmp_seq=2 ttl=57 time=1.27 ms
64 bytes from fra24s11-in-f4.1e100.net (142.250.184.196): icmp_seq=3 ttl=57 time=1.26 ms
64 bytes from fra24s11-in-f4.1e100.net (142.250.184.196): icmp_seq=4 ttl=57 time=1.33 ms
64 bytes from fra24s11-in-f4.1e100.net (142.250.184.196): icmp_seq=5 ttl=57 time=1.46 ms
```

**Comment by JessePython** [comment]
That AMI version is what was specified. I will verify

**Comment by foersleo** [comment]
Looking around a bit more I found a similar/the same issue on the calico github (https://github.com/projectcalico/calico/issues/8001) for Debian12 (also kernel 6.1). They seem to have fixed that with an update of libbpf in calico 3.27. As far as I can tell it has been backported to 3.26.2.

Could you check that you are indeed using a calico version 3.26.2 or later, just to ensure we are not chasing an issue that is already fixed?

**Comment by foersleo** [comment]
Just as a note: I have since redone the experiment with calico version 3.26.0, which indeed produces the described errors when trying to load vmlinux BTF information. That is in line with the expected incompatibility of the older libbpf varsion and the 6.1 kernel as described in the issue linked in my previous post.

**Comment by foersleo** [comment]
Hey @vpsgetcom @JessePython ,

anything new on this issue? Is the problem persisting or was this the expected version incompatibility of older Calico versions with the 6.1 kernel?

Let us know if this can be closed or if there is more investigation needed.

**Comment by foersleo** [comment]
Going to close this issue, as it seems to have gone stale. Please feel free to reopen or open a new issue if the problem is persisting.
